{
  "schema_version": "3.0.0",
  "data_source": [
    {
      "path": "gs://ssb-tip-tutorials-data-produkt-prod/metstat/inndata/observations_p2025-12-01_p2025-12-31_v1.parquet",
      "generation": "1760000000000001"
    }
  ],
  "data_target": [
    {
      "path": "gs://ssb-tip-tutorials-data-produkt-prod/metstat/klargjorte-data/observations_p2025-12-01_p2025-12-31_v1.parquet",
      "generation": "1760000000000002"
    }
  ],
  "event_id": "example-lineage-1",
  "segment_id": "example-segment-1",
  "recorded_at": "2024-01-10T15:00:00Z",
  "git_repository": "https://github.com/statisticsnorway/example-production",
  "image_name": "registry.example/jupyter:example",
  "dapla_environment": "PROD",
  "timezone": "Europe/Oslo"
}